{
  "items": [
    {
      "id": "layout-1",
      "jobId": "job-1",
      "layoutNo": "L-0001",
      "status": "editing",
      "utilization": 0.78,
      "sheetCount": 2,
      "machine": null,
      "updatedAt": "2026-02-13T02:00:00.000Z",
      "jobCode": "JOB-2026-0001",
      "jobName": "机柜门板-批次A"
    }
  ],
  "total": 1,
  "page": 1,
  "pageSize": 50,
  "totalPages": 1
}
